data_coleta,titulo,resumo,instituicao,nivel,area,vagas,inscricoes_inicio,inscricoes_fim,url,status,data_publicacao,fonte,banca,salario_max
2026-06-06T19:57:24.104Z,INSTITUTO PROATIVA DE GESTAO EDUCACIONAL - IPGE,"Professor(a) Pedagogo(a) (Educação Infantil), Superior, Piso Nacional Vigente, 20h, 12, R$ 100,00. 11, Professor(a) Pedagogo(a) (Ensino Fundamental I – Anos ...",Gov Bahia (SEC),Superior,Professor,2026,2026-01-23T00:00:00.000Z,2026-05-15T00:00:00.000Z,https://ipge.selecao.net.br/informacoes/14/,Encerrado,2026-06-02T19:51:40.236Z,Diário Oficial de Gov Bahia (SEC),A definir,4780
2026-06-06T17:48:08.032Z,Concursos e Seleções | Prefeitura de Alagoinhas,PSS 001/2026 – SEDUC – Decreto Nº 6608/2026 – Homologação do ... Concurso Público – 002/2019 – Gabaritos Preliminares da Primeira Etapa do Concurso Público ...,Gov Bahia (SEC),Médio,Professor,10,2026-01-20T00:00:00.000Z,2026-06-02T00:00:00.000Z,https://www.alagoinhas.ba.gov.br/index.php/concursos-e-selecoes/,Encerrado,2026-06-02T17:39:18.213Z,Diário Oficial de Gov Bahia (SEC),A definir,3500
2026-06-06T17:25:59.809Z,&gt;&gt; Diário Oficial Eletrônico - Feira de Santana &lt;&lt;,EDITAL DE CONVOCAÇÃO N° 001/2026 – CONCURSO PÚBLICO 2012. Órgão: Gabinete do Prefeito. Ano: XII. Edição : 3539. Data da Edição: 29/05/2026.,Pref Feira de Santana,Superior,Professor,10,2026-05-13T00:00:00.000Z,2026-05-29T00:00:00.000Z,https://diariooficial.feiradesantana.ba.gov.br/detalhes.asp?publicacao=1&tipo=3&idsec=1&edicao=,Encerrado,2026-06-02T17:18:30.693Z,Diário Oficial de Pref Feira de Santana,A definir,3500
2026-06-06T17:25:59.809Z,Concursos Bahia: confira as vagas e editais para 2026!,"... Bahia, realizará um concurso para a área da educação em 2026! Vagas/ Cargos e salário inicial. Cargo: Professor educação básica; Formação ...",Gov Bahia (SEC),Médio,Professor,246,2026-06-04T17:18:30.693Z,2026-06-21T17:18:30.693Z,https://www.estrategiaconcursos.com.br/blog/concursos-ba/,Aberto,2026-06-02T17:18:30.693Z,Diário Oficial de Gov Bahia (SEC),FGV,37589.95
2026-06-06T17:25:59.809Z,&gt; &gt; &gt; Concursos e Consultoria &lt; &lt; &lt;,. PROCESSO SELETIVO SIMPLIFICADO - EDITAL 001/2026 - PREFEITURA MUNICIPAL DE MANSIDÃO / BA ... São vagas para os cargos de Professor. Informações sobre o Concurso ...,Gov Bahia (SEC),Médio,Professor,10,2026-03-09T00:00:00.000Z,2026-06-22T00:00:00.000Z,https://www.planejarconcursos.com.br/,Aberto,2026-06-02T17:18:30.693Z,Diário Oficial de Gov Bahia (SEC),Planejar Consultoria,3500
2026-06-06T17:25:59.809Z,Seleções e Concursos | SEC - Secretaria de Educação,EDITAL SEC/SUDEPE N° 002/2026 - Processo Seletivo Simplificado Função de Professor Orientador de Estágio em Saúde – REDA. CONVOCAÇÃO PROVA OBJETIVA EDITAL ...,Gov Bahia (SEC),Médio,Professor,10,2026-06-04T17:18:30.693Z,2026-06-21T17:18:30.693Z,http://www.ba.gov.br/educacao/selecoes-e-concursos,Aberto,2026-06-02T17:18:30.693Z,Diário Oficial de Gov Bahia (SEC),A definir,3500
2026-06-07T05:02:31.923Z,Concurso SEDUC Bahia 2026 - Edital 01/2026 - Provimento de Vagas para Professor e Pedagogo,O Governo do Estado da Bahia abre concurso público para provimento de vagas no cargo de Professor Padrão P - Grau III da Educação Básica e Pedagogo. Organizado pela banca FCC.,Gov Bahia (SEC),Superior,Professor,450,2026-06-05T05:02:31.922Z,2026-06-27T05:02:31.922Z,https://www.saeb.ba.gov.br/concursos,Aberto,2026-06-02T05:02:31.922Z,Diário Oficial de Gov Bahia (SEC),FCC,4850
2026-04-15T00:00:00.000Z,Concurso Público IFBA - Edital 11/2026 - Vagas para Professor de Geografia,Estão abertas as inscrições para o concurso público da Instituto Federal da Bahia com oportunidades para o cargo de Professor de Geografia. A seleção é organizada pela banca IBFC. Prova objetiva e avaliação de títulos serão realizadas conforme cronograma oficial.,IFBA,Superior,Professor,15,2026-04-04T09:00:00.000Z,2026-04-24T23:59:59.000Z,https://portal.ifba.edu.br/concursos,Encerrado,2026-03-31T10:00:00.000Z,Diário Oficial de IFBA,IBFC,7500
2026-01-15T00:00:00.000Z,Concurso Público Prefeitura de Salvador - Edital 06/2026 - Vagas para Professor de Educação Física,Estão abertas as inscrições para o concurso público da Prefeitura Municipal de Salvador com oportunidades para o cargo de Professor de Educação Física. A seleção é organizada pela banca IDIB. Prova objetiva e avaliação de títulos serão realizadas conforme cronograma oficial.,Prefeitura de Salvador,Superior,Professor,10,2026-01-02T09:00:00.000Z,2026-01-25T23:59:59.000Z,http://www.concursos.salvador.ba.gov.br/,Encerrado,2025-12-29T10:00:00.000Z,Diário Oficial de Prefeitura de Salvador,IDIB,3500
